{
  "schema_version": "1.0",
  "outcome": "pass",
  "captured_at": "2026-08-30T00:00:00Z",
  "control_seconds": 5,
  "runtime": {
    "outcome": "read_succeeded",
    "availability": "complete",
    "freshness": "live",
    "compatibility": "expected_compatible",
    "window_count": 2,
    "shutdown_clean": true
  },
  "categories": [
    {
      "category": "auth",
      "tracked_before": 1,
      "tracked_after": 1,
      "control_changes": 0,
      "active_changes": 0,
      "active_only_changes": 0,
      "overlapping_changes": 0,
      "active_created": 0,
      "active_removed": 0,
      "active_content_changed": 0,
      "active_metadata_changed": 0,
      "content_fingerprinted_before": 1,
      "content_fingerprinted_after": 1,
      "metadata_only_before": 0,
      "metadata_only_after": 0,
      "metadata_only_bytes_before": 0,
      "metadata_only_bytes_after": 0
    },
    {
      "category": "config",
      "tracked_before": 1,
      "tracked_after": 1,
      "control_changes": 0,
      "active_changes": 0,
      "active_only_changes": 0,
      "overlapping_changes": 0,
      "active_created": 0,
      "active_removed": 0,
      "active_content_changed": 0,
      "active_metadata_changed": 0,
      "content_fingerprinted_before": 1,
      "content_fingerprinted_after": 1,
      "metadata_only_before": 0,
      "metadata_only_after": 0,
      "metadata_only_bytes_before": 0,
      "metadata_only_bytes_after": 0
    },
    {
      "category": "thread",
      "tracked_before": 4,
      "tracked_after": 4,
      "control_changes": 0,
      "active_changes": 0,
      "active_only_changes": 0,
      "overlapping_changes": 0,
      "active_created": 0,
      "active_removed": 0,
      "active_content_changed": 0,
      "active_metadata_changed": 0,
      "content_fingerprinted_before": 2,
      "content_fingerprinted_after": 2,
      "metadata_only_before": 2,
      "metadata_only_after": 2,
      "metadata_only_bytes_before": 2000000,
      "metadata_only_bytes_after": 2000000
    },
    {
      "category": "state",
      "tracked_before": 3,
      "tracked_after": 3,
      "control_changes": 0,
      "active_changes": 0,
      "active_only_changes": 0,
      "overlapping_changes": 0,
      "active_created": 0,
      "active_removed": 0,
      "active_content_changed": 0,
      "active_metadata_changed": 0,
      "content_fingerprinted_before": 2,
      "content_fingerprinted_after": 2,
      "metadata_only_before": 1,
      "metadata_only_after": 1,
      "metadata_only_bytes_before": 4000000,
      "metadata_only_bytes_after": 4000000
    },
    {
      "category": "runtime_cache",
      "tracked_before": 2,
      "tracked_after": 2,
      "control_changes": 0,
      "active_changes": 1,
      "active_only_changes": 1,
      "overlapping_changes": 0,
      "active_created": 0,
      "active_removed": 0,
      "active_content_changed": 1,
      "active_metadata_changed": 0,
      "content_fingerprinted_before": 2,
      "content_fingerprinted_after": 2,
      "metadata_only_before": 0,
      "metadata_only_after": 0,
      "metadata_only_bytes_before": 0,
      "metadata_only_bytes_after": 0
    }
  ],
  "max_fingerprint_file_bytes": 1048576,
  "fingerprint_budget_bytes_per_category": 8388608,
  "protected_active_change_count": 0,
  "runtime_cache_active_change_count": 1,
  "writer_attribution": "snapshot_diff_does_not_identify_writer",
  "paths_redacted": true,
  "fingerprints_redacted": true
}
